id;user_id;search_name;emp_type;domain;from_experience;to_experience;location;status;end_client;skills;employee_name
1;mobile Fish;Home Loan Account Table Computer;Trace;Savings Account alarm;2058;5641;transmitter Implementation Electronics;Soap methodology Albania;Home Namibia;Steel zero administration;Multi-channelled Licensed
2;grey Cambridgeshire;Canyon HDD;Table Small Frozen Sausages Planner;envisioneer Music Public-key;24102;44015;Rubber Buckinghamshire Games;incentivize Tuna copy;Costa Rica Mayotte;Industrial;connect Markets Chief
3;capacitor archive;sky blue Tasty Plastic Pizza;compress South Georgia and the South Sandwich Islands;compelling mission-critical;54269;27599;scalable;Small;deliverables reinvent 24 hour;overriding;monitor 1080p Checking Account
4;world-class Frozen IB;Highway Ergonomic;moratorium moratorium;New York tangible Mississippi;38292;11959;bus synthesize Idaho;Networked Sleek Metal Table Small;Intelligent Outdoors;Harbor Montana;Corporate Phased relationships
5;white Brand Money Market Account;Salad Web virtual;Refined Squares;maroon;89255;88328;projection Fresh;support Gorgeous;withdrawal;copying;ability Hat Iraq
6;magenta Concrete;User-centric Gloves;Mauritania;facilitate Tasty Concrete Chips Exclusive;69630;49724;capability zero tolerance Computers;Analyst paradigms;encompassing;deposit Canadian Dollar Lebanon;Designer Persistent
7;Handmade 24/7 Re-contextualized;web-enabled invoice withdrawal;bypassing optical;installation;18651;69581;HDD;Algerian Dinar;firewall;Future-proofed deposit Sausages;disintermediate Cambridgeshire hacking
8;bricks-and-clicks Concrete Global;Fiji Dollar Profound Bacon;Macao Equatorial Guinea Vision-oriented;Agent;55829;90041;deposit B2B cross-media;programming SCSI drive;invoice Unbranded Cheese;New Zealand Dollar Alabama transform;invoice Home Gloves
9;Buckinghamshire Ports;Devolved driver Networked;Fish;payment calculating;65761;30806;Benin Berkshire;dedicated Persevering;Coordinator Cambridgeshire Investor;cross-platform Borders;Libyan Dinar CSS
10;sensor;Alaska;deposit Chips Applications;uniform PCI back up;95307;92831;architectures;Wisconsin Facilitator Incredible;reinvent;eco-centric Bedfordshire mesh;Configuration UIC-Franc
